{"schema_version":"0.1.0","extension_type":"research_method_result","handoff_binding":{"handoff_id":"HND-RM-001","handoff_digest":"sha256:8888888888888888888888888888888888888888888888888888888888888888","invocation_id":"INV-RM-001","run_id":"RUN-RM-001","context_pack_id":"CTX-RM-001","context_pack_digest":"sha256:874657100280b3bbe1d9cf5224ba5ac86d0d71c55b8a9af8353cb0712648839d","capability_id":"fixture.research-method","function_id":"execute"},"generated_method_design_refs":[],"generated_protocol_refs":[],"generated_instrument_refs":[],"run_results":[{"run_result_id":"RRES-1","run_spec_ref":{"id":"RSPEC-1","version":"1.0.0","content_digest":"sha256:6666666666666666666666666666666666666666666666666666666666666666"},"protocol_ref":{"id":"PROT-1","version":"1.1.0","content_digest":"sha256:4444444444444444444444444444444444444444444444444444444444444444"},"completion_status":"partial","started_at":"2026-08-24T00:00:00Z","ended_at":"2026-08-24T00:01:00Z","input_digest":"sha256:7777777777777777777777777777777777777777777777777777777777777777","raw_data_refs":[{"data_ref_id":"DATA-1","data_kind":"observation","locator":"fixture://run/1/obs/1","content_digest":"sha256:9999999999999999999999999999999999999999999999999999999999999999","epistemic_mode":"empirical","handoff_observation_id":"OBS-RM-001","evidence_adoption_performed":false}],"missing_data":[{"missing_id":"MISS-1","kind":"unavailable_data","statement":"One planned data element was unavailable.","related_data_ref_ids":[]}],"validity_report":{"validity_report_id":"VAL-1","threats":["Synthetic fixture threat label for contract coverage."],"limitations":["Partial run; unavailable data remains."],"coverage":[{"dimension_id":"COV-1","status":"partial","rationale":"One planned data element was unavailable."}],"finding_adoption_performed":false},"research_completion_claimed":false}],"candidate_analyses":[{"candidate_analysis_id":"CAN-AN-1","source_run_result_ids":["RRES-1"],"summary":"Candidate analysis of the partial fixture run.","limitations":["Partial input coverage."],"core_analysis_adoption_performed":false}],"candidate_finding_ids":["CFND-RM-1"],"candidate_next_action_ids":["NA-RM-1"],"candidate_next_method_ids":["NM-RM-1"],"extension_digest":"sha256:a3f4c14c09c7fce9026c0bb79176462638a048d305ec9690aa496100e79a29b1"}